{
  "version": 1,
  "session_id": "jasper-press-build",
  "updated_at": "2026-08-14T14:29:09.279Z",
  "docs_acked": [
    ".compliance/PROTOCOL.md",
    ".cursor/rules/01-mandatory-workflow.mdc",
    ".cursor/rules/02-moloch-testing.mdc",
    "docs/TESTING_GUIDE.md"
  ],
  "code_dirty": false,
  "dirty_files": [
    "components/site/brand.tsx",
    "components/site/brand.test.tsx",
    "lib/brand-mark.test.ts",
    "public/media-kit/jasper-fu-seal-ticked.svg",
    "components/site/site-shell.tsx",
    "app/about/page.tsx",
    "app/page.tsx",
    "app/media-kit/page.tsx",
    "app/globals.css",
    "components/site/site-shell.test.tsx",
    "app/public-routes.test.tsx",
    "app/page.test.tsx",
    "lib/identity-css.test.ts",
    "lib/navigation.ts",
    "lib/navigation.test.ts",
    "app/sitemap.ts",
    "e2e/public-routes.spec.ts",
    "app/seo.test.ts",
    "lib/press-thumbnail.ts",
    "lib/press-thumbnail.test.ts",
    "lib/copy.ts",
    "app/press/page.tsx",
    "app/speaking/page.tsx",
    "lib/media-kit.ts",
    "components/contact/inquiry-form.tsx",
    "lib/press-alert.test.ts",
    "public/logos/ceo-magazine.svg",
    "lib/identity.ts",
    "lib/identity.test.ts",
    "lib/portraits.ts",
    "components/site/hero-portrait-carousel.tsx",
    "components/site/legal-document.tsx",
    "lib/portraits.test.ts",
    "components/site/hero-portrait-carousel.test.tsx",
    "lib/network-field.ts",
    "components/site/network-field.tsx",
    "lib/network-field.test.ts",
    "components/site/network-field.test.tsx",
    "lib/contact.ts",
    "lib/contact.test.ts",
    "components/contact/inquiry-form.test.tsx",
    "lib/legal/drafts.ts",
    "lib/copy.test.ts",
    "app/layout.tsx",
    "components/site/page-head.test.tsx",
    "app/contact/page.tsx",
    "lib/speaking.test.ts",
    "components/speaking/book-jasper-form.tsx",
    "components/speaking/book-jasper-form.test.tsx",
    "lib/speaking.ts",
    "lib/legal/published.ts",
    "lib/legal/terms.ts",
    "app/legal/page.tsx",
    "app/privacy/page.tsx",
    "app/cookies/page.tsx",
    "app/terms/page.tsx",
    "lib/legal/published.test.ts",
    "components/site/legal-page.tsx",
    "components/site/legal-page.test.tsx"
  ],
  "build": {
    "ran": true,
    "passed": true,
    "command": "export PATH=\"/usr/bin:/bin:/usr/sbin:/sbin:/opt/homebrew/bin:$PATH\"\nnpm run build",
    "at": "2026-08-14T14:07:02.272Z",
    "na": false
  },
  "tests": {
    "ran": true,
    "passed": true,
    "command": "export PATH=\"/usr/bin:/bin:/usr/sbin:/sbin:/opt/homebrew/bin:$PATH\"\nnpm test",
    "at": "2026-08-14T14:06:54.967Z",
    "files": []
  },
  "moloch_checklist": {
    "happy": true,
    "validation": true,
    "access": true,
    "boundary": true,
    "verification_fn": true,
    "dry_setup": true,
    "unique_errors": true,
    "path_coverage": true
  },
  "runtime_verify": {
    "ran": true,
    "passed": true,
    "method": "curl",
    "note": "curl evidence recorded by hook",
    "at": "2026-08-14T14:07:15.535Z"
  },
  "notes": "Legal pages use Last updated: August 14, 2026. Forward-looking disclaimer names Coinsub and Jasper Fu. Privacy/cookie/terms taken from the source policy doc, Site host jasperfu.com, contact info@jasperfu.io. Access N/A: public copy. Unique errors: date required vs Insert date vs unpublished; section required vs title vs copy vs counsel placeholder; Coinsub-only disclaimer vs unpublished disclaimer.",
  "ready_to_commit": true,
  "ready_to_declare_done": true
}
